title,score,id,url,comms_num,created,body,timestamp
Times Square right now,484578,l8rf4k,https://v.redd.it/x64z70f7eie61,13963,1612029638.0,,2021-01-30 18:00:38
UPVOTE so everyone sees we got SUPPORT,337214,l6wu59,https://i.redd.it/sgoqy8nyt2e61.png,12875,1611841234.0,,2021-01-28 13:40:34
GME YOLO update — Jan 28 2021,298381,l78uct,https://i.redd.it/opzucppb15e61.png,23071,1611867983.0,,2021-01-28 21:06:23
GME YOLO month-end update — Jan 2021,263032,l846a1,https://i.redd.it/r557em3t5ce61.png,19961,1611954285.0,,2021-01-29 21:04:45
It’s treason then,245901,l881ia,https://i.redd.it/d3t66lv1yce61.jpg,4605,1611963659.0,,2021-01-29 23:40:59
"CLASS ACTION AGAINST ROBINHOOD. Allowing people to only sell is the definition of market manipulation. A class action must be started, Robinhood has made plenty of money off selling info about our trades to the hedge funds to be able to pay out a little for causing people to loose money now",227998,l6x130,https://www.reddit.com/r/wallstreetbets/comments/l6x130/class_action_against_robinhood_allowing_people_to/,17901,1611841751.0,"LEAVE ROBINHOOD. They dont deserve to make money off us after the millions they caused in losses. It might take a couple of days, but send Robinhood to the ground and GME to the moon.",2021-01-28 13:49:11
GME YOLO update — Feb 19 2021,223063,lnqgz8,https://i.redd.it/2xswz0h11ii61.png,12915,1613768755.0,,2021-02-19 21:05:55
GME YOLO update — Jan 27 2021 --------------------------------------- guess i need 102 characters in title now,217290,l6ekdz,https://i.redd.it/a309gkm5yxd61.png,14692,1611782135.0,,2021-01-27 21:15:35
GME YOLO update — Feb 1 2021,216113,lae6j0,https://i.redd.it/og8ca1xskxe61.png,18126,1612213656.0,,2021-02-01 21:07:36
IT'S POWER TO THE TRADERS NOW,215833,l7feld,https://v.redd.it/lu8aekujd6e61,5653,1611884158.0,,2021-01-29 01:35:58
"Daily Discussion Thread for March 29, 2024",69,1bqlqe3,https://www.reddit.com/r/wallstreetbets/comments/1bqlqe3/daily_discussion_thread_for_march_29_2024/,2344,1711707312.0,[View Post](https://www.reddit.com/r/wallstreetbets/post-viewer/1bqlqe3),2024-03-29 10:15:12
"Most Anticipated Earnings Releases for the week beginning April 1st, 2024",321,1bq3sjs,https://i.redd.it/sue2oc9oi4rc1.png,250,1711652844.0,,2024-03-28 19:07:24
DJT stock ,2158,1bqpxg1,https://i.redd.it/sof8ueka4arc1.jpeg,522,1711720644.0,,2024-03-29 13:57:24
"If he had a bank and did the same thing with money, would he have received 25 years?",1630,1bqr5oa,https://i.redd.it/jj77mn1udarc1.jpeg,407,1711723850.0,,2024-03-29 14:50:50
Anyone ever gotten this?,516,1bqu5g0,https://i.redd.it/aygcneu00brc1.jpeg,205,1711731312.0,,2024-03-29 16:55:12
Markets Closed Today For Good Friday,384,1bqpis1,https://i.redd.it/i69sft5n0arc1.jpeg,20,1711719538.0,,2024-03-29 13:38:58
"Institutions already know PCE data one month before you, and the Report is already priced in by the time it drops - here's your proof",161,1bqth2o,https://www.reddit.com/r/wallstreetbets/comments/1bqth2o/institutions_already_know_pce_data_one_month/,73,1711729631.0,"Too many lil dipshits telling me I'm crazy for having this theory, so I took the time to break it down for those mongoloids.

We do not see the PCE report for the prior month until the end of the current month. On March 29, we only just now see February's PCE, but it is the end of March, and that subsequent report will already be just about finished. Institutions get to see those numbers weeks before us.

Here's your proof:

From July 28, 2023 through October 27, 2023, SPY dropped -$40.

From June 1, 2023 through September 30, 2023, PCE stopped declining and ramped up hot at 3.198% to 3.37% ([https://tradingeconomics.com/united-states/pce-price-index-annual-change](https://tradingeconomics.com/united-states/pce-price-index-annual-change))

Keep those dates in mind, and follow along with daddy:

From May 2023 through June 2023, PCE DROPPED 3.96% to 3.19%. The June DROPPED PCE rate would have released to the public on July 28, 2023. This is precisely when SPY began bleeding out. At that time the bleeding began, it would have looked to Retail as though PCE was still cooling. However, at the time June PCE was being released to the public, July data was already in existence, and the July data was going to show that PCE was no longer cooling, and in fact was rising again.

You still with me? Let's fast-forward to the most recent climb, which began on October 26, 2023, which has preceded this most recent vertical line up.

On October 27, 2023, Retail was just getting the released September PCE readings. ([https://fred.stlouisfed.org/releases/calendar?rid=323&ve=2019-12-31&view=week&vs=2019-01-01](https://fred.stlouisfed.org/releases/calendar?rid=323&ve=2019-12-31&view=week&vs=2019-01-01))

As you may recall, September's PCE readings were STILL GOING UP. On October 27, 2023, the public would still be seeing a rise in PCE. However, weirdly, the market began shooting up.

Guess why...

Because the October data showed PCE significantly cooled from 3.37% to 2.95% ([https://tradingeconomics.com/united-states/pce-price-index-annual-change](https://tradingeconomics.com/united-states/pce-price-index-annual-change))

Weirdly, this cooling data from October was not available to the public until November 30, 2023, at which point SPY had already rebounded from $410 to $450.

&#x200B;

That's all. This isn't a conspiracy you clowns, this is real.

&#x200B;

Tl;dr, SPY price movements correlate perfectly with UNRELEASED PCE data, and contradicts the released data.

&#x200B;",2024-03-29 16:27:11
Money making Monday,318,1bqo7vs,https://i.redd.it/uyz0f98wp9rc1.jpeg,148,1711715799.0,,2024-03-29 12:36:39
My addiction can't take another 3 day break,719,1bqi0y4,https://i.redd.it/klca62utr7rc1.jpeg,82,1711692235.0,,2024-03-29 06:03:55
JP Morgan warning to us regards,718,1bqhv9c,https://i.redd.it/eir43ezzp7rc1.jpeg,272,1711691621.0,,2024-03-29 05:53:41
The numbers behind $DJT,2,1bqwiwg,https://i.redd.it/7pssk6l9hbrc1.jpeg,1,1711737111.0,,2024-03-29 18:31:51
Shitcoins,1,1bqwg46,https://i.redd.it/61j898dpgbrc1.jpeg,1,1711736922.0,,2024-03-29 18:28:42
MSFT and openAI plan $100 billion supercomputer,4,1bqwb6e,https://www.theinformation.com/articles/microsoft-and-openai-plot-100-billion-stargate-ai-supercomputer,3,1711736587.0,,2024-03-29 18:23:07
"Microsoft, OpenAI plan $100 billion data-center project",5,1bqw8il,https://www.reuters.com/technology/microsoft-openai-planning-100-billion-data-center-project-information-reports-2024-03-29/,3,1711736415.0,,2024-03-29 18:20:15
NVDA to the moon?!?! Start of Q2,3,1bqw55v,https://www.reddit.com/r/wallstreetbets/comments/1bqw55v/nvda_to_the_moon_start_of_q2/,3,1711736188.0,"Hey guys currently 2am in Singapore, i'm a 19 YO Finance student at a local institution and am ready to  print money in NVDA. Recently this week alone I deposited in about $800 SGD = $550ish USD on Tuesday and managed to get it to about $1500 USD which I'm insanely proud off.

When next Monday opens, I was initally thinking of shorting NVDA as I still believed its overpriced and might come down a lot, but recently I meant in the last 10 mins, I looked through 2023's Start of Q2, Q3 and Q4 and NVDA shot up a lot in the first day, as my strategy for options is no matter how long the DTE is i'll preferably sell the option on the same day to ensure theta dont ruin me.

So since only the only option that is avaible within my budget is a 1 week option of $1500 USD (Strike price of $895 current stock price is $902), y'all reckon following the trend is a good strategy as I predict that there will still be a sell off in the beginning then a $20 gain (Hopefully)

I know that this will essentially be my entire portfolio so fuck it right, im still young and my Finance teacher's been doubting my abilities to make a 10 baggers gotta prove him WRONG!!!

So a $20 gain in NVDA if i get a good entry price this will likely give me a 3.5x of my $1500, i'm not rich by any metrics and if done properly I'll donate $100 to the old people playing harmonica and selling tissues by the train stations promise, to the moon we GO!?!?!?

https://preview.redd.it/amsbimsnebrc1.jpg?width=750&format=pjpg&auto=webp&s=d8e1f0ca27d62a1e2996a2affb4b21edc8035357",2024-03-29 18:16:28
Might be time to short PG&E,2,1bqvvqf,https://www.reddit.com/r/bayarea/s/UI98Hr6y9i,1,1711735563.0,,2024-03-29 18:06:03
The reason why JP Morgan is bearish. 🤣,7,1bqvqv9,https://i.redd.it/ypeka2spbbrc1.jpeg,8,1711735246.0,,2024-03-29 18:00:46
holidays are the worst,6,1bqvmri,https://www.reddit.com/r/wallstreetbets/comments/1bqvmri/holidays_are_the_worst/,2,1711734968.0,"https://preview.redd.it/82wk7ux8bbrc1.jpg?width=500&format=pjpg&auto=webp&s=617a7ac5d53f4c422082cb90997d1a26a603b918

",2024-03-29 17:56:08
CVNA stock in rear view mirror,3,1bqvmcm,https://www.reddit.com/r/wallstreetbets/comments/1bqvmcm/cvna_stock_in_rear_view_mirror/,7,1711734938.0,"I read a lot about financial experts who betted against CVNA this time last year at around $4/share.  As of yesterday it's $87.92/share.  In hindsight, I really wish I didn't listen to the experts this time last year, and got in.  Looking at CVNA from rear view mirror, how did CVNA shares recover more than 20 times of net share value in one year?   I believe decent # of carvana employees were laid off last year, and I personally don't feel it's a good idea to buy a car without seeing it in person.",2024-03-29 17:55:38
Tesla options,2,1bqvfv7,https://www.reddit.com/r/wallstreetbets/comments/1bqvfv7/tesla_options/,4,1711734491.0,Is it a good time to consider tesla options? IV is relatively low for Tesla and earnings are schedule sometime mid April. I think IV is bound to go up and options will go up in price. Im thinking puts since things aren’t looking good considering china and new EV competition. What are your thoughts on this?,2024-03-29 17:48:11
